<?xml version="1.0" encoding="UTF-8"?>
<Hotels xmlns:xsi="http://www.w3.org/2001/XMLSchema-instance"
        xsi:noNamespaceSchemaLocation="https://example.com/Hotels.xsd">

	<Hotel Rating="4.2">
		<Name>Renaissance Scottsdale</Name>
		<ContactNumber>480-123-4567</ContactNumber>
		<ContactNumber>480-234-5678</ContactNumber>
		<Address ClosestAirport="Scottsdale Airport">
			<Number>101</Number>
			<StreetName>East McDowell Rd</StreetName>
			<City>Scottsdale</City>
			<State>AZ</State>
			<PostalCode>85254</PostalCode>
		</Address>
	</Hotel>

	<Hotel Rating="4.5">
		<Name>Hyatt Place Phoenix</Name>
		<ContactNumber>602-345-6789</ContactNumber>
		<Address ClosestAirport="Phoenix Sky Harbor">
			<Number>202</Number>
			<StreetName>North 3rd Ave</StreetName>
			<City>Phoenix</City>
			<State>AZ</State>
			<PostalCode>85004</PostalCode>
		</Address>
	</Hotel>

	<Hotel Rating="4.3">
		<Name>Sheraton Grand at Wild Horse Pass</Name>
		<ContactNumber>480-876-5432</ContactNumber>
		<ContactNumber>480-976-5433</ContactNumber>
		<Address ClosestAirport="Chandler Municipal">
			<Number>5594</Number>
			<StreetName>Wild Horse Pass Blvd</StreetName>
			<City>Chandler</City>
			<State>AZ</State>
			<PostalCode>85226</PostalCode>
		</Address>
	</Hotel>

	<Hotel Rating="3.9">
		<Name>Fairfield Inn Tempe</Name>
		<ContactNumber>480-555-1111</ContactNumber>
		<Address ClosestAirport="Phoenix Sky Harbor">
			<Number>150</Number>
			<StreetName>South Mill Ave</StreetName>
			<City>Tempe</City>
			<State>AZ</State>
			<PostalCode>85281</PostalCode>
		</Address>
	</Hotel>

	<Hotel Rating="4.6">
		<Name>Element Chandler Fashion Center</Name>
		<ContactNumber>480-765-1234</ContactNumber>
		<Address ClosestAirport="Chandler Municipal">
			<Number>344</Number>
			<StreetName>South Chandler Village Dr</StreetName>
			<City>Chandler</City>
			<State>AZ</State>
			<PostalCode>85226</PostalCode>
		</Address>
	</Hotel>

	<Hotel Rating="4.0">
		<Name>Marriott Mesa</Name>
		<ContactNumber>480-789-6543</ContactNumber>
		<ContactNumber>480-789-6544</ContactNumber>
		<Address ClosestAirport="Phoenix-Mesa Gateway">
			<Number>200</Number>
			<StreetName>East Main St</StreetName>
			<City>Mesa</City>
			<State>AZ</State>
			<PostalCode>85201</PostalCode>
		</Address>
	</Hotel>

	<Hotel Rating="4.7">
		<Name>Kimpton Hotel Palomar Phoenix</Name>
		<ContactNumber>602-777-1000</ContactNumber>
		<Address ClosestAirport="Phoenix Sky Harbor">
			<Number>2</Number>
			<StreetName>East Jefferson St</StreetName>
			<City>Phoenix</City>
			<State>AZ</State>
			<PostalCode>85004</PostalCode>
		</Address>
	</Hotel>

	<Hotel Rating="4.4">
		<Name>Embassy Suites by Hilton Scottsdale Resort</Name>
		<ContactNumber>480-990-1414</ContactNumber>
		<Address ClosestAirport="Scottsdale Airport">
			<Number>8001</Number>
			<StreetName>North Hayden Rd</StreetName>
			<City>Scottsdale</City>
			<State>AZ</State>
			<PostalCode>85258</PostalCode>
		</Address>
	</Hotel>

	<Hotel Rating="4.8">
		<Name>Four Seasons Resort Scottsdale</Name>
		<ContactNumber>480-515-5700</ContactNumber>
		<ContactNumber>480-515-5701</ContactNumber>
		<Address ClosestAirport="Scottsdale Airport">
			<Number>10600</Number>
			<StreetName>East Crescent Moon Dr</StreetName>
			<City>Scottsdale</City>
			<State>AZ</State>
			<PostalCode>85262</PostalCode>
		</Address>
	</Hotel>

	<Hotel Rating="4.1">
		<Name>Courtyard by Marriott Phoenix Downtown</Name>
		<ContactNumber>602-555-9876</ContactNumber>
		<Address ClosestAirport="Phoenix Sky Harbor">
			<Number>132</Number>
			<StreetName>South Central Ave</StreetName>
			<City>Phoenix</City>
			<State>AZ</State>
			<PostalCode>85003</PostalCode>
		</Address>
	</Hotel>

</Hotels>
